lineID	SPEAKER	ENGLISH
3982	objEphias	C'est beaucoup trop compliqué à retenir...	
3983	objEphias	Est-ce que tu peux rendre ça un peu |moins| intéressant?	
3984	objBard	Pas maint|enant...	
3985	objBard	Je vais e|ssay|er!	
3986	objEphias	{wiggle}Rurururu...{/wiggle}|| écrire des chansons pour les humains c'est compliqué!	
3987	objEphias	Mais j'aime l'idée!| J'espère qu'on va réussir!	
3988	objEphias	{wiggle}Ruu,|| ruu...{/wiggle}|| C'est cette chanson que tu veux?	
3989	objBard	Laisse|-moi ré|e|ssay|er.	
3990	objBard	Oui!	
3991	objEphias	{shake .6}Chee!!!{}| Je trouve que c'est top!	
3992	objEphias	Maintenant,| il nous reste plus qu'à la chanter!	
3993	objEphias	Encore et encore!	
3994	objEphias	Et les humains viendront en masse!	
3995	objEphias	Hmmm?	
3996	objEphias	T'étais pas en train de chanter...	
3997	objEphias	Quelque chose qui va pas,| ruru?	
3998	objEphias	Tu veux réessayer?	
3999	objBard	Non...	
4000	objBard	Ouais!	
4001	objEphias	Pas de soucis!|| On peut faire une pause.	
4002	objEphias	{shake .6}CHEE!{/shake}	
4003	objEphias	C'est ça l'idée!	
4004	objEphias	Chante avec moi!	
4005	objEphias	{shake .6}CHEE!{/shake}	
4006	objEphias	Regarde tous ces clients qui sont venus!	
4007	objEphias	Tout ça grâce à ton chant!	
4008	objEphias	Je n'ai aucun soucis à te donner ceci!	
4009	objBard	Ouais!	
4010	objEphias	{wiggle}Rururururu...{}	
4011	objEphias	Je vais être riche à présent!	
4012	objEphias	Parle à tout le monde de ma superbe caravane!	
4013	objEphias	J'ai tout genre de plantes et d'insectes que j'ai récupéré| dans la nature sauvage!	
4014	objBard	Est-ce que t'es vraiment un panda?	
4015	objEphias	{shake}CHEE!!!{/shake}|| Oui!	
4016	objEphias	J'ai voyagé dans le monde entier avec ma caravane!	
4017	objEphias	Mais les gens ici ne font pas confiance à un panda roux qui parle...	
4018	objEphias	Ils disent aimer les animaux...|| mais ils ne m'aiment pas...	
4019	objBard	Je trouve que t'es chouette!	
4020	objEphias	Rururu!|| Merci beaucoup!	
4021	objEphias	T'as déjà vécu en pleine nature?	
4022	objEphias	Rururururu!|| À mes yeux il y a rien de mieux!	
4023	objEphias	L'odeur des arbres...	
4024	objEphias	Le son de la pluie sur le toit de ma caravane...	
4025	objEphias	Mais pour être honnête,|| j'ai appris à aimer la nourriture humaine...	
4026	objEphias	J'imagine que c'est aussi pour ça que je commence à avoir besoin d'argent,| chee...		
4027	objEphias	Traverser le désert pour arriver ici c'était très difficile!	
4028	objEphias	J'avais chaud sous ma fourure...	
4029	objEphias	Et j'ai failli être à court de nourriture!|| Chee!	
4030	objEphias	Il y a pas grand-chose à récupérer dans le désert...	
4031	objEphias	Mais j'avais entendu parler d'une superbe ville de l'autre côté!	
4032	objEphias	Avec mon esprit aventurier,| je pouvais pas dire non!	
4033	objEphias	C'est pas facile...	
4034	objEphias	Mais peu importe ce qui arrive,| je garde le sourire!	
4035	objEphias	Tout va finir par s'arranger!| Ruru!	
			
4036	objFallenstar	{background black}{rainbow}{wiggle}Oh mon dieu...	
4037	objFallenstar	You are|| {shake}SO||| CUTE!!!{/shake}	
4038	objFallenstar	This is Earth, right?	
4039	objBard	{}Yes!	
4040	objFallenstar	{background black}{rainbow}{wiggle}Nice	
4041	objFallenstar	I'm carrying a message from the goddess Eya	
4042	objFallenstar	Forever ago,| her song of creation set your universe into motion	
4043	objFallenstar	This is like|| a courtesy message	
4044	objFallenstar	She's gonna sing her song again pretty soon	
4045	objFallenstar	Which,|| um	
4046	objFallenstar	Is going to replace this universe with a new one	
4047	objBard	{}Wait so	
4048	objBard	The world is ending??	
4049	objFallenstar	{background black}{rainbow}{wiggle}Ummmmmmm...	
4050	objFallenstar	Yes	
4051	objFallenstar	But don't freak out about it too much	
4052	objFallenstar	Your universe is pretty old	
4053	objFallenstar	Every few aeons Eya likes to clear things out	
4054	objFallenstar	Start over fresh,|| y'know?	
4055	objFallenstar	...|Maaaa|a|a|a|n...	
4056	objFallenstar	This sucks, actually	
4057	objFallenstar	I really like you	
4058	objFallenstar	Sorry your planet is doomed	
4059	objBard	{}...Is there...	
4060	objBard	ANY|thing we can do about it?	
4061	objFallenstar	{background black}{rainbow}{wiggle}Wel|l|l|l||...	
4062	objFallenstar	Technically||, sort of...	
4063	objFallenstar	But also...||#Not really	
4064	objBard	{}What is it???	
4065	objFallenstar	{background black}{rainbow}{wiggle}Welllll	
4066	objFallenstar	How do I put this	
4067	objFallenstar	Not really	
4068	objFallenstar	Sorry!!!	
			
4069	objBard	...Oh!	
4070	objBard	Je sais pas pourquoi mais je pensais qu'il y avait quelque chose ici...	
			
4071	objBard	...|Peut-être que je devrais réessayer de chanter.	
			
4072	objFernando	Ola!|| On dirait qu'on a un invité spécial dans le public!	
4073	objMatilda	Maintenant que les frontières sont de nouveau ouvertes,| on a repris la route!	
4074	objEduard	Ou...|| la rivière.| Avec mon bateau.	
4075	objMatilda	On est un groupe nautique!	
4076	objBard	{shake}COMME DES PIRATES?!{/shake}	
4077	objFernando	Pas...|| vraiment.	
4078	objFernando	Mais regarde!| J'ai même un nouvel accordéon!	
4079	objMatilda	On se souvient toujours de ta chanson,| d'ailleurs!	
4080	objFernando	C'est vrai!	
4081	objFernando	Est-ce que tu veux l'écouter?	
4082	objBard	Nan	
4083	objBard	Ouais!!	
4084	objFernando	Tu veux qu'on joue ta chanson?	
4085	objBard	Nan	
4086	objBard	Ouais!!	
4087	objFernando	Très bien,| amigo.	
4088	objFernando	Ha|HA!|| C'est parti!	
4089	objEduard	Et un, ||deux, ||trois, ||quatre...	
4090	objFernando	...	
4091	objFernando	Je vais pas éclater mon accordéon cette fois.	
4092	objFernando	Ça coûte une blinde.	
4093	objFernando	Merci pour tous les sourires,| amigo.	
4094	objEduard	Puisse-t-on se retrouver un jour.	
			
4095	objFernando	Ola!	
4096	objFernando	T'es là pour le concert de ce soir?	
4097	objFernando	Je suis dans le groupe,| tu sais.	
4098	objFernando	Et ma partie est la plus importante!	
4099	objFernando	Je suis le dernier à jouer.	
4100	objFernando	Le bouquet finale!	
4102	objFernando	Je suis la partie dont tout le monde se souvient longtemps après le concert!	
4103	objFernando	Ça doit être incroyable de me rencontrer,| hey?	
4104	objFernando	Il y a juste ||un tout petit problème...	
4105	objFernando	...||notre cheffe d'orchestre a perdu la musique.| Alalalala!	
4106	objFernando	Je pourrais sûrement me débrouiller et bricoler un truc moi-même.	
4107	objFernando	Mais comment le groupe arriverait à me suivre?	
4108	objBard	C'est pas po|ssible.	
4109	objBard	Je pou|rrais é|crire une chan|son!	
4110	objFernando	Ça doit être incroyable de me rencontrer,| hein?	
4111	objBard	Oui, dit m'en plus!	
4112	objBard	Je suis là pour é|crire une chan|son.	
4113	objFernando	Ola!	
4114	objFernando	J'attends juste le concert de ce soir.	
4115	objBard	Je suis im|pa|tient!	
4116	objBard	Je vais é|crire ta par|tie!	
			
4117	objFernando	C'est fâcheux mais c'est vrai.	
4118	objFernando	Souhaite leur bonne chance ce soir.	
			
4119	objFernando	Bah,| je suis né à Mohabumi, une sorcière comme les autres...	
4120	objFernando	Mais j'ai toujours su que j'étais destiné à de grandes choses!	
4121	objFernando	Mais bon,| assez parlé de moi.	
4123	objFernando	Notre cheffe d'orchestre a besoin de musique pour ce soir.	
4124	objFernando	Mais c'est pas bien grave!	
4125	objFernando	Je vais me débrouiller!	
4126	objFernando	Souhaite-moi bonne chance pour le concert de ce soir!	
			
4127	objFernando	Bah,| va bien falloir l'être!	
			
4128	objFernando	Quoi?|| {shake .5}TOI?{}	
4129	objFernando	Tu penses être capable de faire un truc digne d'un bouquet final?	
			
4130	objFernando	Bah,| voyons ce que tu sais faire!	
4131	objFernando	C'est ça!!!|| Le bouquet final!	
4132	objBard	Eh ouais!	
4133	objBard	Fais|ons des chan|gements!	
4134	objFernando	Pas de problème!	
4135	objFernando	Fais-moi voir ce que t'as!	
			
4136	objFernando	Ola!| Mon amigo du bateau!	
4137	objFernando	Tu profites bien de Mohabumi?	
4138	objFernando	Il se trouve...	
4139	objFernando	Qu'on est tout proche de mon coin préféré de toute la ville!	
4140	objFernando	La salle de concert Le Cratère!	
4141	objFernando	Tous les meilleurs musiciens au monde viennent jouer ici!	
4142	objFernando	Je jouerais bien moi-même,| mais...	
4143	objFernando	J'ai éclaté mon accordéon.	
4144	objFernando	J'ai peut-être pas pensé à tout ça jusqu'au bout.	
4145	objFernando	Tu dois toujours suivre la musique.	
4146	objFernando	C'est l'esprit d'un vrai musicien!	
4147	objFernando	Et,| parfois...	
4148	objFernando	La musique te dit d'éclater ton accordéon.	
4149	objFernando	Et d'y mettre le feu!	
4150	objFernando	Personne peut dire pourquoi elle nous demande ça.	
4151	objFernando	Mais quand tu deviens musicien,	
4152	objFernando	Tu prêtes allégeance à ses lubies.	
4153	objFernando	T'as l'esprit d'un vrai musicien.	
4154	objFernando	Je le savais pas quand je t'ai rencontré...	
4155	objFernando	Mais maintenant!|| Je peux le sentir!	
4156	objFernando	Le tien rayonne autant que le mien!	
4157	objFernando	Nous sommes des âmes soeurs,| amigo.	
4158	objFernando	Emporte la musique dans ton coeur, où que tu ailles.	
			
4159	objFernando	Euhhh.	
4160	objFernando	Le bouquet final doit avoir plus de notes que ça.	
4161	objFernando	Je suis désolé,| c'est la règle.	
4162	objBard	J'y a|rrive pas.	
4163	objBard	Je vais e|ssay|er!	
4164	objFernando	Whooaaa!!!	
4165	objFernando	Ça a l'air pas mal compliqué!	
4166	objFernando	Heh...|| mais je peux gérer.	
4169	objFernando	Sérieux?	
4170	objFernando	O|K| alors,| amigo.	
4171	objFernando	Est-ce que ça sonne comme un bouquet final...?	
4172	objBard	Lai|sse|-moi ré|e|ssa|yer.	
4173	objBard	On est bon!	
4174	objFernando	Hey,| ça marche...	
4175	objBard	Lai|sse|-moi ré|e|ssa|yer.	
4176	objBard	Re|joue l'an|cien?	
4177	objBard	On est bon!	
4178	objFernando	Ça c'est l'ancien...	
4179	objBard	Laisse|-moi re|chan|ter.	
4180	objBard	Rejoue ce que je viens de chan|ter?	
4181	objBard	Rem|place ça!	
4182	objFernando	Pas de souc'!	
4183	objFernando	On dirait bien qu'on a notre final.	
4184	objFernando	Il reste plus qu'à jouer ça!	
4185	objFernando	Faut juste s'assurer que le groupe soit bien avec nous!	
			
4186	objFlowersteal	Alors?|| Tu la prends?	
4187	objBard	Non!	
4188	objBard	Ouais!	
4189	objMiriam	Bon,| ok...	
			
4190	objSandra	Oh mince!!!|| Il est plus grand que ce qu'on pensait!	
4191	objVivian	{shake}{quake}PAS DE PROBLÈME!!!{/shake}	
4192	objVivian	Souviens-toi de notre entrainement!	
4193	objSandra	{shake}{quake}{glitch .6}GAH!!!	
4194	objVivian	{quake}C'est quoi ces trucs???	
			
4195	objMiriam	{shake}{name}!!!{/shake}	
4196	objMiriam	Qu'est-ce que tu fiches là???	
4197	objBard	Euh!|| Eh bah...	
4198	objBard	Les murs sont trop haut pour que je puisse grimper au dessus...	
4199	objBard	Ces sorcières ont dit qu'elles avaient besoin d'aide...	
4200	objMiriam	{shake}{quake}Vraiment irresponsable!!!{/shake}	
4201	objMiriam	Ce truc est dangereux!!!	
4202	objMiriam	J'arrive pas à croire qu'elles t'aient laissé les rejoindre...	
4203	objMiriam	...	
4204	objMiriam	On dirait| qu'il y a pas moyen d'empêcher ça,| alors...	
4205	objMiriam	On dirait| que je vais devoir aider à combattre cette chose.	
4206	objMiriam	Mais seulement pour sauver |{wiggle}tes{/wiggle}| miches!	
			
4207	objVivian	{shake}EH OUAIS!!!	
4208	objSandra	Un de moins!!!	
4209	objBard	{}Woohoo!	
4210	objMiriam	{{shake .6}COMMENCE PAS À FAIRE |"WOOHOO"|!!!	
4211	objMiriam	{}On a failli mourir à cause de ces stupides sorcières!	
4212	objMiriam	Deux fois!	
4213	objMiriam	C'est quoi votre problème,| hein?	
4214	objMiriam	C'était quoi ce truc??	
4215	objVivian	On sait pas,| boss!	
4216	objVivian	Ils ont commencé à apparaitre il y a peu...	
4217	objMiriam	Vous voulez dire...||| que ce sont pas |{qiggle}les vôtres?{/wiggle}	
4218	objVivian	{wiggle}Les nôtres?{/wiggle}|| Qu'est-ce que tu veux dire?	
4219	objMiriam	Euh. |Je pensais que les monstres étaient...	
4220	objMiriam	{size .8}Euh...	
4221	objMiriam	Genre...|| un truc de sorcières...?	
4222	objVivian	{shake}QUOI?{/shake}|| Pas du tout,| boss!	
4223	objVivian	C'est un mystère total pour nous!	
4224	objVivian	Tout ce qu'on sait...	
4225	objVivian	C'est qu'ils ont commencé à apparaitre quand la princesse a disparu...	
4226	objMiriam	Oh...|| la princesse...	
4227	objVivian	Ouais,| la princesse!	
4228	objVivian	Et le truc bizarre c'est...	
4229	objVivian	Qu'ils sortent...|| du sol?	
4230	objVivian	Et ils ont pas vraiment l'air d'avoir de conscience...	
4232	objSandra	{shake}VIVIANE!!!{}	
4233	objSandra	N'oublie pas!!	
4234	objSandra	Les civiles sont pas censés savoir tous ces trucs!!!	
4235	objVivian	Oh.|| Ouais.	
4236	objVivian	Désolée!	
4237	objVivian	C'est des secrets militaires,| j'imagine.	
4238	objVivian	Mais vu que vous nous avez aidés à battre ce truc...	
4239	objVivian	On peut vous faire confiance pour garder ça pour vous,| hein?	
4240	objVivian	C'est où que vous avez dit que vous alliez,| déjà?	
4242	objMiriam	On va à la capitale...|| J'imagine...	
4243	objSandra	Oh!|| Tu veux dire Mohabumi?	
4244	objSandra	C'est facile!!	
4245	objSandra	On peut vous aider à y aller sans problème!	
4246	objSandra	Vous voulez qu'on vous dépose?	
4247	objMiriam	{size .7}non	
4249	objMiriam	{size .7}Vous avez bousillé mon balai.	
4250	objSandra	{}{quake}{shake .2}Nan mais c'est ce que je dis!!!	
4251	objSandra	{}On peut se rattraper!	
4252	objBard	(Je me dis qu'on devrait aller avec elles,| Miriam...)	
4253	objMiriam	{size .7}...	
			
4254	objFrancine	Bardelet!	
4255	objFrancine	Oh,| bonté divine...	
4256	objFrancine	Je ne pensais pas te revoir un jour!	
4257	objFrancine	Tu nous as tellement manquées à Marley et à moi.	
4258	objFrancine	Il s'en est passé des choses,| ici...	
4259	objFrancine	C'est ce que les esprits avaient annoncés,| je suppose...	
4260	objFrancine	Je n'arrive pas à croire que ce soit la fin...	
4261	objFrancine	C'était si difficile pour nous,| avec tout ça...	
4262	objFrancine	Surtout pour Ruby...	
4263	objFrancine	J'étais tellement inquiète pour elle...	
4264	objFrancine	Mais la maire m'a dit de ne pas m'en faire,	
4265	objFrancine	Et de plutôt retrouver Marley...	
4266	objFrancine	Elle s'est occupée de Ruby à ma place.	
4267	objFrancine	Elle est...|| tellement gracieuse,| bardelet.	
4268	objFrancine	La maire,| je veux dire.	
4269	objFrancine	J'admire tellement sa force.	
4270	objFrancine	Elle tient vraiment à nous.	
4271	objFrancine	J'aimerais...|| pouvoir devenir comme elle.	
4272	objFrancine	J'aimerais avoir encore assez de temps pour devenir cette personne.	
4273	objFrancine	Tous ces gens comptent tellement pour moi...	
4274	objFrancine	Langtree est vraiment un endroit spécial.	
4275	objFrancine	Tu as toujours eu ta place parmi nous,| bardelet.	
4276	objFrancine	Je suis tellement heureuse...	
4277	objFrancine	D'avoir pu te revoir à nouveau.	
			
4278	objFrancine	Bardelet!|| Oh,| bonté divine...	
4279	objFrancine	Un |{shake}esprit||| malfaisant{/shake}|| est apparu dans la maison de Ruby...	
4280	objFrancine	J'ai essayée de la faire sortir, mais...	
4281	objFrancine	Eh bien,| tu sais comment elle peut être têtue...	
4282	objFrancine	C'est tellement une si gentille,| gentille vieille dame!	
4283	objFrancine	Si quelque chose devait lui arriver,| je...	
4284	objFrancine	J'ai pensée à demander de l'aide,| mais...	
4285	objFrancine	Et si quelque chose lui arrivait pendant que j'étais pas là?	
4286	objFrancine	Je suis terrifiée,|| je peux pas| bouger!	
4287	objFrancine	J'ai honte...	
			
4288	objFrancine	Alors?||#Est-ce que Ruby va bien??	
4289	objBard	...	
4290	objBard	Elle va bien.	
4291	objFrancine	Merci énormément!	
4292	objFrancine	T'es vraiment un héros, bardelet.	
4293	objFrancine	Ruby est tellement||| si gentille et douce...	
4294	objFrancine	Une femme adorable comme elle| ne mérite pas d'être hantée!	
4295	objBard	...	
4296	objFrancine	La maire sera sûrement ravie d'entendre qu'on s'est occupé des esprits! 	
4297	objFrancine	Bonté divine qu'elle était inquiète...	
4298	objFrancine	La maire sera sûrement ravie d'entendre qu'on s'est occupé des esprits!	
4299	objFrancine	Bonté divine qu'elle était inquiète...	
4300	objFrancine	Merci d'avoir aidé Ruby,| bardelet...	
4301	objFrancine	Je me demande ce qu'un esprit malveillant comme ça voulait à cette pauvre vieille dame...	
4302	objFrancine	Quand j'étais petite, Ruby chantait à l'Arbre du Sommeil	
4303	objFrancine	C'était apparemment un rituel pour communier avec le Régent...	
4304	objFrancine	Mais il ne nous a jamais répondu.	
4305	objFrancine	Je sais que Ruby peut paraître un peu dure parfois.	
4306	objFrancine	Mais son coeur est bon...|| juste vieux,| et mis à l'épreuve.	
4307	objFrancine	Maintenant que Ron est de retour, Ruby a l'air|| plus heureuse.	
4308	objFrancine	Personnellement,| je le trouve toujours un peu effrayant en fantôme...	
4309	objFrancine	J'ai tellement été distraite avec Ruby, que j'ai à peine vu Marley...	
4310	objFrancine	Je suis reconnaissante qu'elle soit compréhensive. 	
			
4311	objFrancisco	Eh bien,| si ce n'est pas l'autre farfelu. 
4312	objFrancisco	T'en as pas eu assez, hein?	
4313	objFrancisco	Je plaisante.	
4315	objFrancisco	La vérité c'est que...	
4316	objFrancisco	L'équipage tout entier est un peu farfelu.	
4317	objFrancisco	Je me suis voilé la face à nier l'évidence.	
4318	objFrancisco	C'est bon de te revoir.	
4319	objFrancisco	Alors,| à vrai dire...	
4320	objFrancisco	Je pensais à arrêter le café.	
4321	objFrancisco	...|Ouais...	
4322	objFrancisco	Je ne dors pas très bien avec.	
4323	objFrancisco	Et ça me fait me sentir anxieux tout le temps.	
4324	objFrancisco	Je n'ai pas bu une seule tasse aujourd'hui.	
4325	objFrancisco	Le ciel est bombardé d'étoiles qui brillent,	
4326	objFrancisco	Donc ça n'a pas été trop compliqué de rester éveillé.	
			
4327	objFrancisco	La première fois que tu es monté sur notre bateau,	
4328	objFrancisco	J'étais persuadé que tu ne serais qu'une source de problèmes.	
4329	objFrancisco	Et j'avais raison...	
4330	objFrancisco	Mais| tu vas tout de même me manquer.	
4331	objFrancisco	Bonne chance avec quelle que soit la prochaine chose étrange,| et farfelue que tu feras...	
4332	objFrancisco	Hey,| avant que tu ne t'en ailles...	
4333	objFrancisco	Soit honnête...	
4334	objFrancisco	Est-ce que tu trouves| que j'ai un visage qui fait peur?	
4335	objBard	Non!	
4336	objBard	Oui.	
4337	objFrancisco	Huh.|| Ok...	
4338	objFrancisco	Je pensais que c'était le cas,	
4339	objFrancisco	Mais c'est difficile d'obtenir une réponse honnête auprès des gens.	
4340	objFrancisco	C'est ce que je me disais...	
4341	objFrancisco	Désolé si c'était bizarre de demander ça maintenant.	
4342	objFrancisco	Je me suis juste toujours posé la question...	
4343	objFrancisco	OK,| à plus.	
			
4344	objFrancisco	Wow.|| Eh bien.	
4345	objFrancisco	Merci de t'être occupé de cet idiot.	
4346	objFrancisco	Je pensais que tu étais trop farfelu pour vraiment être utile.	
4347	objFrancisco	Je suis ravi que tu m'aies prouvé le contraire.	
4348	objFrancisco	Maintenant que j'y pense,	
4349	objFrancisco	Nous rencontrons beaucoup plus de problèmes depuis que nous t'avons rencontré.	
4350	objFrancisco	Le chaos te suit partout où tu passes...	
4352	objFrancisco	Euh.|| Je ne voudrais pas paraître méchant.	
4353	objFrancisco	Tu sais|||, après toute cette agitation...	
4354	objFrancisco	Je prendrais bien un café.	
			
4355	objFrancisco	Parbleu!	
4356	objFrancisco	Qu'est-ce qui se passe?|| Tout le monde a perdu la tête...	
4357	objFrancisco	Est-ce que c'est ta faute?	
4358	objFrancisco	Le Capitaine Lucas a dit que nous partions à la recherche des sirènes?	
4359	objFrancisco	Quoi?	
4360	objFrancisco	N'avaient-elles pas disparu depuis des années?	
4361	objFrancisco	Ça m'allait bien de juste vendre des grains...	
			
4362	objFrancisco	On m'a confié la vente des grains de café.	
4363	objFrancisco	D'habitude c'est le boulot de Penny...	
4364	objFrancisco	...	
4365	objFrancisco	Ugh.|| Je m'ennuie.	
4368	objFrancisco	On boit tout le temps du café,| alors on ne dort pratiquement jamais sur ce navire.	
4369	objFrancisco	Je ne sais pas comment n'importe qui peut supporter ça sans dormir,| cela dit.	
4370	objFrancisco	J'ai envie de planter tout le monde.||| Dans le visage.	
4371	objFrancisco	Est-ce que tu veux des {wiggle}graiiiiiiiiins| de| cafééééééééééé?{/wiggle}	
4372	objFrancisco	Est-ce que |{wiggle}tu{}| veux des {wiggle}graiiiiiiiiins de cafééééééééééé??{/wiggle}	
4373	objFrancisco	{shake .25}Est-ce que |{wiggle}quelqu'un{/wiggle}| veux des {wiggle}graiiiiiiiiins de cafééééééééééé???	
			
4374	objFrancisco	Rien de tel qu'une tasse de café après une dure journée.	
4375	objFrancisco	J'espère que tout le monde a pu se débarrasser de son envie de chanter.	
4376	objFrancisco	Je vais bien dormir ce soir.|| Ha ha,| je plaisante.
			
4377	objFrancisco	Ugh,| je suis tellement fatigué.	
4378	objFrancisco	Je ne me souviens même plus c'est quand la dernière fois que j'ai dormi...	
4379	objFrancisco	...Alors pourquoi j'ai encore envie de café?	
4380	objFrancisco	Je suis celui qui dirige ce navire.	
4381	objFrancisco	Ce qui veut dire que c'est moi qui nous guide vers le droit chemin.	
4382	objFrancisco	Et ça va {wiggle .25}au-delà{} du sens littéral.	
4383	objFrancisco	Je ne tolère pas les bêtises.	
4384	objBard	...	
4385	objBard	Heh!| Moi non plus!	
4386	objBard	Je suis dans une aventure {wiggle}sérieuse{/wiggle}.	
4387	objFrancisco	...	
4388	objFrancisco	Tu m'as l'air du genre farfelu.	
4389	objFrancisco	Évidemment, ils t'ont laissé embarquer sur le navire sans me consulter.	
4390	objFrancisco	Je veux dire.| Ça va.	
4391	objFrancisco	Juste,| ne casse rien s'il te plait.	
			
4392	objFrancisco	{shake}SOUPIR.	
4393	objFrancisco	{}Encore un mug de perdu.| Fabuleux.	
4394	objFrancisco	{shake}URGH.	
4395	objFrancisco	{}S'il te plait, |{wiggle}essaie{/wiggle}| d'être prudent avec ça?	
4396	objFrancisco	{shake}Qui continue de donner du café à ce trublion??	
4397	objFrancisco	{shake}Ces tasses|| sont pas peu chères!!!{/shake}	
4398	objFrancisco	Enfin je veux dire,| elles le sont,|| relativement parlant...	
4399	objFrancisco	{quake}{shake}MAIS CE N'EST PAS LE SUJET!{/shake}	
4400	objFrancisco	Arrête| de les casser!!!	
4401	objFrancisco	Est-ce que tu...	
4402	objFrancisco	Sérieu|{wiggle}sement.	
4403	objFrancisco	...	
			
4404	objFrannie	Étranger!	
4405	objBard	Euh...	
4406	objBard	Miriam?	
4407	objBard	{shake}{quake}MIRIAM!!!{}	
4408	objMiriam	{shake}{quake}JE SUIS RÉVEILLÉE JE SUIS RÉVEILLÉE!!!{}	
4409	objMiriam	Rhooh...	
4410	objFrannie	L'esprit...	
4411	objFrannie	Est-ce qu'il est vraiment parti?	
4412	objBard	Ouais!	
4413	objFrannie	On avait peut-être tort à votre sujet.	
4414	objFrannie	On pensait que vous veniez...|| de l'autre côté de la frontière...	
4415	objBard	||...Euh?	
4416	objFrannie	Vous devez |VRAIMENT| vraiment pas être d'ici, hein?	
4417	objBard	Ah ça oui!	
4418	objFrannie	Bon,| laissez-moi vous simplifier tout ça.	
4419	objFrannie	Par ici, il y a deux grands royaumes.	
4420	objFrannie	Rulle...|| c'est nous,| à l'est...	
4421	objFrannie	Et Chaandesh|, à l'ouest.	
4422	objFrannie	Ça fait des générations que nous sommes en guerre...	
4423	objBard	...|Pourquoi?	
4424	objOlaf	Pour de |NOMBREUSES| raisons, voyageur!	
4425	objOlaf	Leurs attaques à notre égard sont interminables!	
4426	objOlaf	Même jusque dans cette forêt...	
4427	objOlaf	Elle était autrefois luxuriante, remplie d'arbres et de fleurs.	
4428	objOlaf	Mais les Chaandeshois l'ont réduite en cendres!	
4429	objOlaf	Ils n'ont aucun respect pour la nature...	
4430	objFrannie	On est dans une zone neutre ici, à la frontière.	
4431	objFrannie	Donc on est toujours à l'affût du moindre espion.	
4432	objFrannie	Ce fantôme que t'as chassé...|| elle venait de Chaandesh,| elle aussi.	
4433	objBard	Elle m'a transmis un message!	
4434	objBard	Pour le Roi de Rulle...	
4435	objFrannie	Un message pour notre roi,| qui vient de Chaandesh?	
4436	objFrannie	Ça peut pas être bon.	
4437	objMiriam	C'est quoi le message?	
4438	objBard	Je sais pas...	
4439	objBard	Mais elle m'a dit que ça mettrait fin à la guerre!	
4440	objBard	Je peux le sentir |attendre| en moi...	
4442	objBard	Je pense qu'on devrait aller le remettre!	
4443	objMiriam	{size .7}Pourquoi faut toujours que ça tombe sur nous...	
4444	objBard	{}Kwa?	
4445	objMiriam	J'ai dis super!	
4446	objMiriam	Allons remettre ce message fantôme au Roi!	
4447	objBard	Ouais!	
4448	objFrannie	...	
4449	objFrannie	J'apprécie ce que tu as fait pour moi et mon auberge,| étranger.	
4450	objFrannie	Donc je ne vais pas| t'arrêter...	
4451	objFrannie	Mais je dirais juste||...| sois prudent avec un message pareil.	
4452	objFrannie	C'est sans doute difficile à comprendre vu que vous êtes pas d'ici,	
4453	objFrannie	Mais tout ce qui vient de Chaandesh...|| on a appris à s'en méfier.	
4457	objBard	Quoii|iii|i|ii?	
4458	objBard	Mais elle avait l'air si gentille!	
4459	objBard	Je veux dire,|| elle était complètement terrifiante,	
4460	objBard	Et elle m'a attaquée avec des boules fantomatiques de toutes les couleurs,	
4461	objBard	Mais...	
4462	objBard	Après ça,|| elle était sympa!	
