lineID	SPEAKER	ENGLISH
12165	objRupali	Une fois,| quand j'étais petite,| je me suis retrouvée séparée de mes parents...	
12166	objRupali	J'avais si peur...| mais Yoshi m'a aidé me sentir mieux...	
12167	objRupali	Il a commencé à hurler jusqu'à ce que mes parents nous trouvent.	
12168	objRupali	C'est un p'tit gars malin.	
12169	objRupali	Rentrer et sortir de Rulle c'est devenu compliqué avec la progression de la guerre.	
12170	objRupali	Est-ce que t'es étrangé à Rulle?|| Comment t'as fais pour entrer?	
12171	objRupali	Je parie que t'as dû te frayer un chemin à travers le mur de la frontière,| pas vrai?	
12172	objRupali	Aha|ha|ha|ha!	
12173	objRupali	Tu verrais ta tête!	
12174	objRupali	Je fais que plaisanter,| tu sais...	
			
12175	objRyan	Euhhh.|| Salut.	
12176	objRyan	J'ai pas vraiment l'temps d'te parler.	
12177	objRyan	Je suis un gars plutôt cool à Delphi.	
12178	objRyan	Est-ce que tu pourrais te tenir|, genre...|| loin là-bas?	
12179	objRyan	Tu pourris mon groove.	
12180	objRyan	Comment je suis devenu si cool?|| C'est simple.	
12181	objRyan	J'ai juste ouvert les yeux sur à quel point tout était nul.	
12182	objRyan	Les gens respectent ce genre de vision.	
			
12183	objRyan	{shake}C'est toi!!!	
12184	objRyan	Le chanteur du Crazy Raven!!!{/shake}	
12185	objRyan	Votre concert a changé ma {shake}vie{/shake}.	
12186	objRyan	Je pensais qu'être cool c'était tout dans la vie.	
12187	objRyan	Mais te voir sur scène là...	
12188	objRyan	Tellement ||inspirant...|| à être {wiggle}tellement{/wiggle}| pas cool...	
12189	objRyan	J'ai réalisé que pas être cool c'était une autre manière d'être cool.	
12190	objRyan	Je fanboy sur toi de manière |{shake}si forte{/shake}| maintenant!	
12191	objRyan	Ça me rend,| genre,| extrêmement pas cool??	
12192	objRyan	C'est un nouveau monde étrange et excitant qui s'ouvre à moi!!	
			
12193	objRyan	Euhhhh	
12194	objRyan	{size .7}wow	
12195	objRyan	{size .7}c'est...	
12196	objRyan	{size 1}{shake}*Ahem*{/shake}	
12197	objRyan	|||Plutôt nul.	
12198	objRyan	{size .7}w-whoa	
12199	objRyan	{size .7}cette voix...	
12200	objRyan	{size 1}{shake}*Tousse| tousse tousse*{/shake}	
12201	objRyan	C'est,| euh...|| vraiment pas si cool.	
12202	objRyan	{size .7}{wiggle}{shake .2}s-|si|| cooool...	
12203	objRyan	{shake}{size 1}NUL{/shake} je veux dire,|| très nul.	
12204	objRyan	T'es |pas cool.	
			
12205	objRyan	{shake}WHAAAAAOOOOOOOWWWW!!!!{/shake}	
12206	objRyan	SI {quake}{wiggle}COOOOOOOOL!!!{/wiggle}	
12207	objRyan	{wiggle}EEEEEeeeeeeee!!!{/wiggle}	
12208	objRyan	{shake}Tellement| sugoi!!!{/shake}	
			
12209	objSaher	J'en peux plus de ce temps chaud.	
12210	objSaher	C'est terrible pour ma peau.	
12211	objSaher	...	
12212	objSaher	Tu peux acheter un truc si tu veux,| au passage.	
12213	objSaher	Mais tu m'as pas l'air du genre à aimer les bijoux.	
12214	objSaher	Les gens dans cette ville traitent les étrangers comme la peste.	
12215	objSaher	C'est cruel.| Je déteste ça.	
12216	objSaher	Je suis venu de loin pour être à l'abri de la guerre.	
12217	objSaher	Mais ici je me sens exclu...	
12218	objSaher	Et avec les monstres qui viennent nous attaquer,| on dirait qu'on est pas à l'abri ici non plus.	
12219	objSaher	J'arrive pas à croire que Chaandesh puisse vraiment envoyer des géants...	
12220	objSaher	Ils sont beaucoup plus grand que les petits gars dans la forêt.	
12221	objSaher	Mais hey, tout ce conflit est complètement fou.	
12222	objSaher	Je pense qu'on a tous hâte que ça se termine.	
			
12223	objSaj	Bonjour...	
12224	objSaj	Serais-tu intéressé par une potion...?	
12225	objSaj	||Je les ai toutes faites moi-même...	
12226	objSaj	La science derrière tout ça est très intéressante...	
12229	objSaj	Tous mes ingrédients sont d'origine naturelle...	
12230	objSaj	Et j'utilise toutes mes connaissances en chimie pour préparer mes concoctions...	
12233	objSaj	Mes potions sont de haute qualité...	
12234	objSaj	Elles produisent des résultats constants...	
12235	objSaj	Tu devrais en acheter...	
12236	objBard	Ça a l'air chouette!	
12237	objBard	Mais,| j'ai pas d'argent.	
12238	objSaj	Oh...	
			
12239	objSaj	Euh...| Bonjour...	
12240	objSaj	Encore vous...	
12241	objBard	Nous sommes là pour la Potion de Puissance!	
12242	objSaj	||Wow...	
12243	objSaj	Vous me paraissiez pas être| du genre dépensier...	
12246	objSaj	Ça va vous coûter un paquet de Farquaads...	
12247	objMiriam	Farqu|oi?	
12248	objSaj	Euh...|?	
12249	objSaj	Farquaads?	
12250	objSaj	Comme genre...| la devise...?| L'argent...?	
12251	objBard	Oh!	
12252	objBard	On en a pas ça...	
12253	objSaj	|Oh...	
12254	objSaj	Bah,| dans ce cas...	
12255	objSaj	Vous pouvez pas l'avoir...	
12256	objBard	Ah!	
12257	objBard	Il y a rien qu'on puisse faire pour...| que vous nous la donniez?	
12258	objSaj	|Peut-être pour certaines de mes potions...	
12259	objSaj	Mais la Potion de Puissance c'est...| un produit de luxe...	
12260	objSaj	Il vous faudrait un coffre rempli de Farquaads pour vous l'offrir...	
12262	objMiriam	{shake}AAARRGGH!	
12263	objMiriam	{shake .4}OUBLIEZ ÇA!!!	
12264	objMiriam	Ma grand-mère et moi avions l'habitude de faire des potions!	
12265	objMiriam	C'est pas si difficile!	
12266	objMiriam	Allez vous faire voir vous et votre magasin à la noix!!!	
12267	objMiriam	On va la faire nous-même pour moins chère!!	
12268	objSaj	{}||Ok...	
12269	objMiriam	Tirons-nous d'ici, {name}!	
12270	objSaj	|Bonne chance avec la préparation de la potion...	
12271	objSaj	La Potion de Puissance peut s'avérer très difficile à créer...	
12272	objSaj	J'espère que ton amie sait ce qu'elle fait...	
12273	objSaj	À vrai dire,| si c'est le cas,| j'aimerais bien lui parler...	
12274	objSaj	Il y a pas beaucoup d'amateurs de potions par ici...	
12275	objSaj	Traditionnellement, les potions sont vues comme un truc magique...	
12276	objSaj	Mais,| les gens à Rulle font pas trop confiance à la magie...	
12277	objSaj	Donc,| à la place j'utilise des connaissances en chimie...	
12278	objSaj	Je pense que ça rend les potions bien meilleures,| en vrai...	
12279	objSaj	Elles produisent des résultats constants...	
12280	objSaj	|Ton amie n'utilise pas de magie...| dis-moi?	
12281	objSaj	Elle va peut-être avoir quelques problèmes par ici...	
12282	objSaj	|J'ai vu que le Héros était en ville...	
12283	objSaj	C'est très intéressant, pour un fabricant de potions comme moi...	
12284	objSaj	Ça c'est quelqu'un qui pourrait s'offrir une Potion de Puissance...	
12285	objSaj	Euh...| sans offense...	
			
12286	objVivian	{shake}BOSS!!!{/shake}	
12287	objSandra	T'es revenu!	
12289	objVivian	On a continué de protéger Chaandesh pendant que t'étais pas là.	
12290	objSandra	C'était difficile!	
12291	objSandra	Les monstres sont devenus de pire en pire...	
12292	objVivian	Difficile pour n'importe quelles sorcières,| peut-être!	
12293	objVivian	{shake}MAIS PAS POUR NOUS!!!{/shake}	
12294	objSandra	Nan,| c'était vraiment difficile,| par contre!	
12295	objVivian	Ouais j'imagine que c'était plutôt difficile.	
12296	objSandra	Et puis,| tout à coup...	
12297	objSandra	Ils ont simplement...|| disparu!	
12298	objSandra	C'était un miracle!	
12299	objVivian	Ils ont sûrement abandonné après qu'on les ait bien amochés!	
12300	objSandra	Quelque chose de très spécial a dû se produire,| je pense.	
12301	objSandra	On a entendu ta voix de loin,| très loin...	
12302	objSandra	Enfin,| bien plus que ta voix.	
12303	objVivian	C'était quelque chose d'énorme!	
12304	objVivian	Un million de voix qui résonnaient en même temps!	
12305	objVivian	Comme ce que t'as chanté au Roi et à la Reine...	
12306	objVivian	C'est comme ça qu'on a su que c'était toi,| boss!	
12307	objSandra	Et d'un seul coup,| tout le monde s'est mis à chanter!	
12308	objSandra	C'était| vraiment puissant...	
12309	objVivian	Oh ouais!	
12310	objVivian	Ça me fait penser.	
12311	objVivian	T'as vraiment||| une très jolie voix, San!	
12312	objSandra	Oh!||...| Merci!	
12313	objSandra	On dirait que la guerre va prendre fin.	
12314	objSandra	Alors peut-être que Chaandesh n'aura plus besoin de protectrices...	
12315	objVivian	Ouais!|| C'est vrai!	
12316	objVivian	On était en train de discuter de faire tomber les masques.	
12317	objSandra	Je suis prête à être à nouveau une simple sorcière...	
12318	objVivian	Pas moi!	
12319	objVivian	On pourrait combattre le crime,| ici chez nous!!	
12320	objVivian	Mais je pourrais pas faire ça sans toi, San...	
12321	objSandra	Flûte!	
			
12322	objSanta	...	
12323	objSanta	De me dire...	
12324	objSanta	Que pendant toutes ces années...	
12325	objSanta	Le rêve que je poursuivais...	
12326	objSanta	N'étais pas un succès.	
12327	objSanta	||C'est dur...	
12328	objSanta	Peut-être qu'il est temps	
12329	objSanta	Que je fasse une pause...	
12330	objSanta	Tu peux t'en aller.	
12331	objSanta	J'ai beaucoup de choses auxquels penser.	
12332	objSanta	Je suis en colère,| mais également soulagé.	
12333	objSanta	En colère d'entendre que mes jouets n'ont pas apportés de joie...	
12334	objSanta	Mais soulagé que certains ont eu le courage de me le dire.	
12335	objSanta	Je dois profondément repenser à ce que je fais.	
			
12336	objSanta	Alo||-ho|-ho|-rs...	
12337	objSanta	{wiggle}Tu es{/wiggle}| celui qui perturbe le fonctionnement de mon usine.	
12339	objSanta	Je suis|| vraiment très déçu!	
12340	objSanta	Quand on autorise des gens à venir travailler ici...	
12341	objSanta	Nous les intégrons à notre famille.	
12342	objSanta	Pourquoi voudrais-tu décevoir cette famille?	
12343	objBard	||Parce que...	
12344	objBard	On veut faire fermer l'usine!	
12345	objSanta	...faire fermer...|| l'usine?	
12346	objBard	Oui!	
12347	objSanta	...	
12348	objSanta	Comment|| peux-tu suggérer une chose pareille!	
12349	objSanta	Depuis le jour où j'ai démarré cette entreprise...	
12350	objSanta	J'ai travaillé sans relâche| pour apporter de la joie aux gens!	
12352	objSanta	Et Gamin Bonheur est mon plus bel ouvrage!	
12353	objSanta	C'est le meilleur jouet!	
12354	objSanta	Il apporte le sourire|| à tout le monde!	
12355	objSanta	Pourquoi voudrais-tu...	
12356	objSanta	en priver le monde...?	
12357	objSanta	Détestes-tu la joie?!	
12358	npcs[whiner]	Si vous pensez que Gamin Bonheur apporte de la joie...	
12359	npcs[whiner]	Et bah...|| {shake}{quake}vous savez pas ce que c'est la joie!!!{/shake}	
12360	npcs[balalaika]	Tout le monde dans cette ville souffre à cause de l'usine...	
12361	npcs[whiner]	C'est énorme,| bruyant| et infect...	
12362	npcs[boxer]	Personne n'aime vraiment Gamin Bonheur!	
12363	npcs[boxer]	C'est qu'un jouet!	
12364	npcs[strong]	Mais nos vies sont ruinées à les fabriquer!	
12365	npcs[strong]	Ça n'apporte pas de joie du tout!	
12367	objBard	Non!!!	
12368	objBard	Si vous pensez que Gamin Bonheur apporte de la joie...	
12369	objBard	Alors...|| vous ne savez pas ce qu'est la joie!	
12370	objBard	Tout le monde dans cette ville est triste à cause de l'usine...	
12371	objBard	C'est énorme,| bruyant| et infect...	
12372	objBard	Personne n'aime vraiment Gamin Bonheur!	
12373	objBard	C'est qu'un jouet!	
12374	objBard	Mais c'est la vie entière des gens qui est ruinée à les fabriquer!	
12375	objBard	Ça n'apporte pas de joie |{wiggle}du tout!{/wiggle}	
12376	objSanta	...|Oh...	
12378	objSanta	...	
12379	objSanta	C'est fini.	
12380	objBard	Kwa...?	
12381	objSanta	J'ai stoppé l'usine.	
12382	objBard	Juste| comme ça...?	
12383	objSanta	Tout ce que j'ai toujours voulu,| c'était apporter de la joie aux gens.	
12384	objSanta	Je pensais que Gamin Bonheur était enfin la réponse...	
12385	objSanta	|||Mais je constate que ce n'est pas le cas...	
12386	objSanta	Peut-être| qu'en mon absence,| le monde a changé...	
12387	objSanta	Ou peut-être que c'est moi...	
12388	objSanta	Mais qu'importe la raison,	
12389	objSanta	Si mon usine ne fait plus son travail,	
12390	objSanta	|Il faut que je revois son objectif...	
12391	objBard	...	
12393	objSanta	Vous tous...	
12394	objSanta	Repartez d'où vous venez.	
12395	objSanta	|J'ai beaucoup de choses auxquels penser...	
			
12541	objSavita	Cet endroit est nul.	
12542	objSavita	Xiatian me manque tellement...	
12543	objSavita	Maintenant je suis coincée ici...	
12544	objSavita	Avec personne d'autre que grand-père et notre qin...	
12545	objSavita	{shake .5}soupir...	
12546	objSavita	J'ai jamais rencontrée de sorcière avant.	
12547	objSavita	Est-ce que tu peux faire un tour de magie?	
12548	objBard	Oh,| je| suis pas une sorcière!	
12549	objBard	Mais mon amie Miriam en est une.	
12550	objSavita	Est-ce qu'elle peut faire un tour de magie?	
12551	objBard	{size .7}Je sens que si je lui demande,| elle va se fâcher.	
12552	objSavita	C'est comment une sorcière?	
12553	objBard	Bah,| Miriam| est tout le temps grincheuse.	
12554	objBard	Mais elle est aussi vraiment cool!	
12555	objBard	Une fois elle s'est même battue contre le Héros!	
12556	objSavita	Donc elle est tout le temps grincheuse,| et elle se bat contre le Héros?	
12557	objSavita	J'imagine que c'est pour ça que tout le monde déteste les sorcières...	
12558	objBard	Attends,| c'est pas ce que je voulais dire!	
12559	objSavita	Oh,| ok.	
			
12560	objSayali	Oh	
12561	objSayali	Désolée si je ne t'ai pas remarqué à l'instant...	
12562	objSayali	Je...|| travaille sur mon mémoire...	
12563	objSayali	À faire que des allers-retours,	
12564	objSayali	de ma chambre à la librairie,	
12565	objSayali	jours et nuits,	
12566	objSayali	pour toujours...	
12567	objSayali	Et...	
12568	objSayali	j'oublie...	
12569	objSayali	comment| parler...	
12570	objSayali	Comme|| quelqu'un de normal...	
12571	objSayali	J'étudie différents types de magie...	
12572	objSayali	Des individus différents produisent des magies différentes,	
12573	objSayali	Même quand ils essaient de faire la même chose...	
12574	objSayali	Mais maintenant je flippe,| parce que...	
12575	objSayali	Il y a pas moyen que je trouve une explication à ça...	
12576	objSayali	C'est pas ça qui fera une présentation très convaincante...	
12577	objSayali	L'Académie c'est tellement important pour moi...	
12578	objSayali	J'ai toujours grandi en me disant que j'étudierais ici...	
12579	objSayali	J'en rêvais même...	
12580	objSayali	Et maintenant que j'y suis,	
12581	objSayali	Je voulais créer le mémoire le plus novateur...	
12582	objSayali	Vraiment |{wiggle}découvrir{/wiggle}| quelque chose...	
12583	objSayali	Mais c'est plus facile à dire qu'à faire...	
12584	objSayali	Maintenant j'espère simplement obtenir mon diplôme...	
			
12585	objSeal	{color red}0	
			
12586	objBard	Oh.|| C'est verrouillé!	
12587	objSecretboatroom	Ex|{wiggle}cuse{/wiggle}-moi!!!	
12588	objSecretboatroom	Cette cabine est réservée à un invité,	
12589	objSecretboatroom	{shake .5}VII||-AÏE||-PII{}|| très important| sur ce bateau!!!	
12590	objSecretboatroom	Ne va pas les déranger!	
12591	objSecretboatroom	Penses-y à deux fois avant de faire irruption dans une cabine au hasard!	
12592	objBard	{size .6}(Mais c'est marrant...)	
			
12593	objMiriam	Wow.	
12594	objMiriam	Quelle bande de nazes.	
12595	objMiriam	Allez, continuons.	
12596	objMiriam	Avant qu'ils reviennent...	
			
12597	objMiriam	|Hey...	
12598	objMiriam	...Ça ressemble à un {glitch .35}truc!	
12599	objBard	{shake}GAH!!!{/shake}	
12600	objMiriam	Whoa!!!	
12601	objMiriam	...|Tu l'as en pleine face!	
12602	objBard	{shake}JE SAIS!!!{/shake}	
12603	objMiriam	Fais|| quelque chose!!!	
12604	objMiriam	J'essaierais bien d'utiliser ma magie...	
12605	objMiriam	...|mais je risquerais sûrement de te blesser...	
12606	objMiriam	Eh beh,| il est vraiment à fond!	
12607	objMiriam	Pfiou!	
12608	objMiriam	Peut-être que tu devrais essayer de chanter?	
12609	objMiriam	...	
12610	objMiriam	T'abandonnes, là?	
12611	objMiriam	Tu devrais essayer de chanter.	
12612	objMiriam	...	
12613	objMiriam	OK...	
12614	objMiriam	Je sais vraiment pas quoi te dire.	
12615	objMiriam	Tu devrais vraiment essayer de chanter.	
12616	objMiriam	...	
12617	objBard	!	
12618	objBard	J'ai pas du tout aimé ça!	
12619	objMiriam	{size .7}(Je te l'avais dit...){/size}	
12620	objBard	J'avais tellement peur!	
12621	objBard	Mais au final c'était pas si horrible.	
12622	objMiriam	Ouais, c'est juste un p'tit machin.	
12623	objMiriam	Je me demande d'où il vient...?	
12624	objMiriam	Oh.	
12625	objMiriam	On devrait fuir.	
12626	objBard	On devrait chanter!	
12627	objMiriam	{shake .5}Quoi...{}	
12628	objBard	Ça marche!|| Pas vrai?	
12629	objBard	Il faut qu'on traverse la forêt pour rencontrer le Roi!	
12630	objBard	Alors| on doit essayer...	
12631	objMiriam	Tu sais quoi...	
12632	objMiriam	Vas-y.	
12633	objMiriam	Fais-toi plaisir.	
			
12634	objBard	...Où est-ce qu'ils sont tous passés...?	
			
12635	objShiro	{shake .5}Les Chaandeshois c'est des fous!{/shake}	
12636	objShiro	Fais-moi confiance,| jeunot.| J'étais marié à l'une d'entre elles!	
12637	objShiro	Ils apprennent toutes sortes de magies farfelues là-bas...	
12638	objShiro	{shake .7}Leur fais|| PAS| confiance!!!{/shake}	
12639	objShiro	Avant j'avais une belle tignasse!	
12640	objShiro	Mais quand ma femme Chaandesh m'a quitté et bah mes cheveux aussi...	
12641	objShiro	À cause de sa |{shake .5}magie!!!{/shake}	
12642	objShiro	Voilà le genre de fêlés que c'est,| jeunot!	
12643	objShiro	Elles utilisent des sorts pour le moindre petit truc!	
12644	objShiro	Si tu veux mon avis,| c'te guerre dure depuis bien,| bien trop d'années...	
12645	objShiro	On aurait déjà dû écraser ces sorcières depuis le temps!	
12646	objShiro	C'est quelque chose d'horrible,| la guerre.	
12647	objShiro	Mais faut bien qu'il y en ait pour se battre contre ce mal!	
			
12648	m1	{size 1.5}{background #180431}{color #FFC86B}(Ça fait tellement bizarre...)	
12649	m1	(De monter sur le balai de quelqu'un d'autre...)	
12650	m1	{size 1}(Scrogneugneuh...)	
			
12651	objBard	Vous voulez aider à renverser l'usine?		
12652	objSiobhan	Oh bah!|| Quelle question!	
12653	objSiobhan	Je suis déjà assez occupée avec le courrier,| comme tu peux le voir...	
12654	objSiobhan	Désolée d'avoir |{wiggle}expédiée{/wiggle}|| tes rêves!	
12655	objSiobhan	Je voyais pas comment |{wiggle}t'adresser{/wiggle}|| ça autrement!	
12656	objBard	...	
12657	objSiobhan	Alors c'en est fini de l'usine...	
12658	objSiobhan	Mais il y aura toujours du courrier!	
12659	objSiobhan	J'imagine que Chismest va enfin se sentir |{wiggle}délivré{/wiggle}|, hoo hoooo!	
12660	objSiobhan	'alut Beth!	
12661	objSiobhan	{wiggle}Couteau{/wiggle}|| d'te voir!	
12662	objSiobhan	Tu vois,| c'est une blague,| parce que couteau ça sonne un peu comme content	
12663	objBeth	J'ai compris.	
12664	objSiobhan	Faut bien rester emmitouflé avec ce temps!	
12665	objSiobhan	Faudrait pas que t'éternue et que tu... ||{wiggle}tasse!{/wiggle}	
12666	objBeth	Mhm.	
12667	objBeth	Comment ça va avec le courrier?	
12668	objSiobhan	Pas mal occupée!| J'ai beaucoup de |{wiggle}pain sur la planche{/wiggle}|, hoo!	
12669	objBeth	...	
12670	objBeth	{size .8}Pour l'amour| d'Eya...	
12671	objSiobhan	Oh!|| Enchantée! Je te fais pas la {wiggle}bise{/wiggle}|!	
12672	objSiobhan	Il fait plutôt froid dehors,| tu trouves pas?	
12673	objSiobhan	C'est moi qui m'assure que tout le monde reçoive son courier.	
12674	objSiobhan	Par temps pluvieux ou par grand soleil, |{wiggle}gel{/wiggle}| ne raterais pas un seul jour!	
12675	objSiobhan	Jamais je ne...|| {wiggle}lettrerais{/wiggle}| ça arriver!	
12676	objSiobhan	Ce serait |{wiggle}blizzard{/wiggle}!	
12677	objSiobhan	{size .7}(OK, je me |||{wiggle}caille{/wiggle}| avec les jeux de mots).	
12678	objSiobhan	C'est facile de critiquer.	
12679	objSiobhan	...	
12680	objSiobhan	{size .7}À croire qu'ils sont expé|{wiggle}rire{/wiggle}|mentés sur le sujet...	
12681	objSiobhan	Je crois bien que j'ai mis le |{wiggle}paquet{/wiggle}!	
12682	objSiobhan	Tu sais,| il a toujours fait froid par ici,| mais l'usine a rendu le temps encore plus froid!	
12683	objSiobhan	Ce nuage de pollution bloque le soleil...	
12684	objSiobhan	C'est un |{wiggle}frais{/wiggle}| problème!	
12685	objSiobhan	Maintenant que l'usine est fermée...| tu penses qu'ils vont |{wiggle}geler{/wiggle}| leurs actifs?	
12686	objSiobhan	{size .7}...|c'est trop?	
12687	objSiobhan	Hehe,| t'as |{wiggle}polaire|{/wiggle} d'apprécier mes jeux de mots!	
12688	objSiobhan	Je peux pas m'arrêter...	
			
12689	objSophie	Les sorcières sont de loin les personnes les plus hypocrites,| ennuyeuses|| et agaçantes de cette planète.	
12690	objSophie	Si tu veux mon avis.	
12691	objSophie	Je suis pas vraiment fière d'être l'une d'entre elles.	
12692	objSophie	Et on nait avec des couleurs de cheveux tellement bizarres...	
12693	objSophie	Rose,| vert,| cyan...?||| Beurk.	
12694	objSophie	J'aime bien la couleur de cheveux des humains normaux.	
12695	objSophie	J'imagine que c'est évident vu l'état de mes cheveux.	
12696	objSophie	Je comprends pas vraiment pourquoi nous sommes en guerre.	
12697	objSophie	Genre,| c'est quoi le problème avec Rulle?|| Est-ce qu'ils ont fait quelque chose?	
12698	objSophie	Ils m'ont l'air chouette.	
12699	objSophie	Qu'est-ce que j'en sais.	
12700	objSophie	Je voudrais déménager d'ici quand je serais plus vieille.	
12701	objSophie	Sûrement pas aller à l'Académie.	
12702	objSophie	Je traverserais l'océan.	
12703	objSophie	Ou j'irais à Rulle,| tiens.	
12704	objSophie	Débuter une nouvelle vie dans un nouveau lieu étrange...	
12705	objSophie	Ça me semble|| presque excitant...	
			
12706	objAngel	{angel}Oh hey!	
12707	objAngel	P'tit b!!!	
12708	objMiriam	{}{size 1.2}C'est qui	
12709	objAngel	{angel}Oh tu sais	
12710	objAngel	Juste une vieille pote	
12711	objBard	{}{size 1.2}Elle est de mèche avec le héros!	
12712	objMiriam	De mèche,| hein?	
12713	objAngel	{angel}P'tit b...| Je suis de mèche avec {shake .5}TOUT| LE| MON|DE{/shake}	
12714	objAngel	Vous êtes tous mes p'tits chouchous.	
12715	objAngel	Je fais pas de favoritisme	
12716	objMiriam	{}{size 1.2}...	
12717	objMiriam	{size .9}Je l'aime pas...	
12718	objBard	{}{size 1.2}Qu'est-ce qui s'est passé ici?	
12719	objAngel	{angel}Un grosse bagarre!!!	
12720	objAngel	|Entre Audrey et des monstres je veux dire	
12721	objAngel	Tout va toujours super bien entre Audrey et moi haha	
12722	objAngel	C'était| {shake .5}ziiiiinziiin!{/shake}	
12723	objAngel	Les monstres étaient tous genre| blah blah blah rahhh!!!	
12724	objAngel	Et Audrey était là en mode...| schwing!| paf!|| ka-|{shake}boum!!!{/shake}	
12725	objMiriam	{}{size 1.2}...	
12726	objBard	{}{size 1.2}...	
12727	objAngel	{angel}{size .9}Elle est juste| trop cool	
12728	objAngel	{size 1.2}Elle a sauvé cette ville en beauté	
12729	objAngel	Je crois qu'ils sont en train de fêter ça avec elle	
12730	objMiriam	{}{size 1.2}Oh, super	
12731	objMiriam	{}{size 1.2}Alors |{shake .7}elle{/shake}| est là...	
12733	objAngel	{angel}Comme ça vous allez pouvoir passer plus de temps ensemble!	
12734	objBard	{}{size 1.2}Je crois pas avoir envie de la voir...	
12735	objMiriam	Elle craint!	
12736	objAngel	{angel}...	
12737	objAngel	Elle| est pas si horrible!	
12738	objAngel	Enfin, une fois que t'apprends à la connaître	
12739	objAngel	Mais ok je me tire	
12740	objAngel	Je faisais que traîner dans les parages	
12741	objAngel	Je m'attendais pas à vous voir	
12742	objAngel	Euh mais bonne chance!	
12743	objAngel	Sur tout ce truc|| du Chant de la Terre!	
12744	objAngel	0	
			
12745	objAngel	{angel}Hey p'tit barde	
12746	objBard	{}Est-ce que|| tu me suis?	
12747	objAngel	{angel}Hehe non	
12748	objAngel	J'suis pas mal occupée en fait	
12749	objAngel	Mais pas trop occupée pour toi ;)	
12750	objBard	{}Occupée avec quoi?	
12751	objAngel	{angel}C'pas tes oignons!	
12752	objAngel	Donc cet accordéoniste...	
12753	objAngel	Tu vas l'aider, pas vrai?	
12754	objBard	{}J'en ai envie!	
12755	objSpirit1goddess	{angel}Est-ce que tu sais ce que tu vas faire?{}{background black}	
12756	objBard	J'ai pas d'i|dée.	
12757	objBard	J'ai une i|dée!	
12758	objAngel	{angel}Bah	
12759	objAngel	Tu peux parler aux fantômes maintenant,| pas vrai?	
12760	objBard	{}...	
12761	objBard	Ah ouais.	
12762	objAngel	{angel}Eh bah,| ok	
12763	objAngel	{angel}Tu vas t'en sortir!	
12764	objAngel	0	
			
12765	objBard	{}J'arrive pas|| à croire ce type!!!	
12766	objAngel	{angel}Désolée,| p'tit barde	
12770	objBard	{}Est-ce que je devrais vraiment abandonner...?	
12771	objAngel	{angel}{speed 1.5}Non!	
12772	objAngel	{speed .7}Enfin	
12773	objAngel	{speed 1.5}Je veux dire	
12774	objAngel	Tu pourrais	
12775	objAngel	Mais	
12776	objAngel	{speed 1}Je crois en toi,| p'tit barde	
12777	objAngel	C'était pas trop le cas avant	
12778	objAngel	Mais maintenant que je vois ta détermination	
12779	objAngel	J'y crois	
12780	objAngel	Je pense que tu peux vraiment apprendre le Chant de la Terre	
12781	objBard	{}Mais comment?	
12782	objBard	Si le Régent ne m'aide pas...	
12783	objAngel	{angel}Il y en a 6 autres	
12784	objAngel	Et chacun en possède un morceau	
12786	objAngel	Donc peut-être,	
12787	objAngel	Qu'il aille se faire voir
12788	objAngel	Et trouvons les autres.	
12789	objBard	{}...	
12790	objBard	Où?	
12791	objAngel	{angel}{speed .2}Jsaipaaaas	
12793	objAngel	{speed 1}Une chose à la fois|, tu vois?	
12794	objAngel	D'abord, règle cette histoire de fantômes chez toi	
12795	objAngel	Ok je me tire	
12796	objAngel	L'arbre de sortie est sur ta gauche	
12797	objAngel	Bises	
			
12798	objAngel	{angel}0	
12799	objAngel	{}{angel}Bienvenue dans le monde des esprits	
